{
  "schema_version": 1,
  "contract_id": "statement_total_v1",
  "metric": "statement_total",
  "unit": "BRL_minor",
  "stage": "authoring",
  "signature": {
    "context": "explicit_versioned_instrumented_claim",
    "operands": "resolve_roles_from_metric_evaluator_registry",
    "output": {
      "kind": "money_minor"
    }
  },
  "semantics": [
    "Consultar closing_day/due_day do cartão. A referência statement_due fixa a data de vencimento; o ciclo histórico termina no closing_day desse mês e começa exclusivamente no closing_day do mês anterior.",
    "Somar consumo confirmed do cartão em (previous_close, current_close]. Este contrato preserva a representação histórica v1; não renomeia essa janela para a semântica nova do kernel sem revisão."
  ],
  "algebraic_properties": [
    "Evento no fechamento atual é incluído; no fechamento anterior é excluído."
  ],
  "reuse": {
    "path": "scripts/agent/validateFinancasBotNextFacts.mjs",
    "locator": "derive.statement_total",
    "status": "behavior_reference_requires_instrumented_adaptation"
  },
  "limitations": [
    "Assinatura de autoria; executável instrumentado e seu closure ainda não foram construídos/revisados.",
    "A fórmula opera somente sobre handles e roles resolvidos do registry, com escopo/período comprovados pelo grafo.",
    "Não usar oracle como input, autodeclarar trace ou aceitar campo non_material."
  ]
}
