{
  "schema_version": 1,
  "contract_id": "invoice_payment_target_card_v1",
  "metric": "invoice_payment_target_card",
  "unit": "entity_ids",
  "stage": "authoring",
  "signature": {
    "context": "explicit_versioned_instrumented_claim",
    "operands": "resolve_roles_from_metric_evaluator_registry",
    "output": {
      "kind": "id"
    }
  },
  "semantics": [
    "Retornar ID do cartão resolvido por settles_card_id do pagamento consultado. Não inferir identidade da fatura a partir do cartão."
  ],
  "algebraic_properties": [
    "Alterar vínculo comprovado altera a identidade retornada; igualdade do texto de label não preserva identidade."
  ],
  "reuse": {
    "path": "scripts/agent/validateFinancasBotNextFacts.mjs",
    "locator": "derive.invoice_payment_target_card",
    "status": "behavior_reference_requires_instrumented_adaptation"
  },
  "limitations": [
    "Assinatura de autoria; executável instrumentado e seu closure ainda não foram construídos/revisados.",
    "A fórmula opera somente sobre handles e roles resolvidos do registry, com escopo/período comprovados pelo grafo.",
    "Não usar oracle como input, autodeclarar trace ou aceitar campo non_material."
  ]
}
