{
  "schema_version": 1,
  "contract_id": "category_budget_remaining_v1",
  "metric": "category_budget_remaining",
  "unit": "BRL_minor",
  "stage": "authoring",
  "signature": {
    "context": "explicit_versioned_instrumented_claim",
    "operands": "resolve_roles_from_metric_evaluator_registry",
    "output": {
      "kind": "money_minor"
    }
  },
  "semantics": [
    "Subtrair consumo elegível da categoria no ciclo do limite familiar registrado. budget_person adicional prova membership; não transforma limite familiar em limite individual.",
    "O caso M-08 aplica o consumo da pessoa explicitamente consultada ao limite familiar, preservando a relação revisada no contrato v1; essa especialização deve ser declarada no binding, não deduzida de nome."
  ],
  "algebraic_properties": [
    "Uma contribuição elegível adicional altera o total pela contribuição definida; evento fora do escopo não altera resultado."
  ],
  "reuse": {
    "path": "scripts/agent/validateFinancasBotNextFacts.mjs",
    "locator": "derive.category_budget_remaining",
    "status": "behavior_reference_requires_instrumented_adaptation"
  },
  "limitations": [
    "Assinatura de autoria; executável instrumentado e seu closure ainda não foram construídos/revisados.",
    "A fórmula opera somente sobre handles e roles resolvidos do registry, com escopo/período comprovados pelo grafo.",
    "Não usar oracle como input, autodeclarar trace ou aceitar campo non_material."
  ]
}
