{
  "schema_version": 1,
  "contract_id": "account_balance_v1",
  "metric": "account_balance",
  "unit": "BRL_minor",
  "stage": "authoring",
  "signature": {
    "context": "explicit_versioned_instrumented_claim",
    "operands": "resolve_roles_from_metric_evaluator_registry",
    "output": {
      "kind": "money_minor"
    }
  },
  "semantics": [
    "Somar opening_balance_minor da conta com amount_minor dos movimentos confirmed da mesma conta até as_of inclusive.",
    "opening_balance_as_of representa o saldo imediatamente antes dos movimentos desse dia civil. Selecionar eventos em [account.opening_balance_as_of, claim.period.value], ambos inclusivos, com início <= fim. O início referencia diretamente o campo da conta; o fim referencia diretamente o corte do claim. Não incluir movimento anterior ao saldo inicial."
  ],
  "algebraic_properties": [
    "Alterar saldo inicial por d altera resultado por d com movimentos fixos.",
    "Evento posterior ao corte não altera resultado."
  ],
  "reuse": {
    "path": "scripts/agent/validateFinancasBotNextFacts.mjs",
    "locator": "derive.account_balance",
    "status": "behavior_reference_requires_instrumented_adaptation"
  },
  "limitations": [
    "Assinatura de autoria; executável instrumentado e seu closure ainda não foram construídos/revisados.",
    "A fórmula opera somente sobre handles e roles resolvidos do registry, com escopo/período comprovados pelo grafo.",
    "Não usar oracle como input, autodeclarar trace ou aceitar campo non_material."
  ]
}
