{
  "schema_version": 1,
  "contract_id": "refund_amount_v1",
  "metric": "refund_amount",
  "unit": "BRL_minor",
  "stage": "authoring",
  "signature": {
    "context": "explicit_versioned_instrumented_claim",
    "operands": "resolve_roles_from_metric_evaluator_registry",
    "output": {
      "kind": "money_minor"
    }
  },
  "semantics": [
    "Somar max(0, amount_minor) dos eventos de compensação consultados, exigindo vínculo ao evento compensado.",
    "Um vínculo elegível resolve um evento diferente, da mesma pessoa, em estado confirmed e de categoria expense; o evento consultado tem categoria compensation. O período filtra o estorno, não a data do alvo.",
    "A derivation lê e valida os IDs escalares de person_id, category_id e compensates do candidato contra as referências resolvidas. A pessoa resolvida tem kind person; a igualdade com person_id do alvo não simula segunda travessia. Lê e resolve também category_id do alvo para verificar expense. Essas validações não substituem proof, seus predicados ou a aceitação integral."
  ],
  "algebraic_properties": [
    "Uma contribuição elegível adicional altera o total pela contribuição definida; evento fora do escopo não altera resultado."
  ],
  "reuse": {
    "path": "scripts/agent/validateFinancasBotNextFacts.mjs",
    "locator": "derive.refund_amount",
    "status": "behavior_reference_requires_instrumented_adaptation"
  },
  "limitations": [
    "Assinatura de autoria; executável instrumentado e seu closure ainda não foram construídos/revisados.",
    "A fórmula opera somente sobre handles e roles resolvidos do registry, com escopo/período comprovados pelo grafo.",
    "Não usar oracle como input, autodeclarar trace ou aceitar campo non_material."
  ]
}
