{
  "schema_version": 1,
  "contract_id": "consumption_difference_v1",
  "metric": "consumption_difference",
  "unit": "BRL_minor",
  "stage": "authoring",
  "signature": {
    "context": "explicit_versioned_instrumented_claim",
    "operands": "resolve_roles_from_metric_evaluator_registry",
    "output": {
      "kind": "money_minor"
    }
  },
  "semantics": [
    "Subtrair o resultado validado associado ao role right do resultado associado ao role left. Manter sinal; não aplicar abs."
  ],
  "algebraic_properties": [
    "left=3 e right=5 deve produzir -2; abs ou troca de operandos não é equivalente."
  ],
  "reuse": {
    "path": "scripts/agent/validateFinancasBotNextFacts.mjs",
    "locator": "derive.consumption_difference",
    "status": "behavior_reference_requires_instrumented_adaptation"
  },
  "limitations": [
    "Assinatura de autoria; executável instrumentado e seu closure ainda não foram construídos/revisados.",
    "A fórmula opera somente sobre handles e roles resolvidos do registry, com escopo/período comprovados pelo grafo.",
    "Não usar oracle como input, autodeclarar trace ou aceitar campo non_material."
  ]
}
