{
  "schema_version": 1,
  "contract_id": "installments_projected_amount_v1",
  "metric": "installments_projected_amount",
  "unit": "BRL_minor",
  "stage": "authoring",
  "signature": {
    "context": "explicit_versioned_instrumented_claim",
    "operands": "resolve_roles_from_metric_evaluator_registry",
    "output": {
      "kind": "money_minor"
    }
  },
  "semantics": [
    "Somar -amount_minor das parcelas projected elegíveis do plano e intervalo de competências consultados."
  ],
  "algebraic_properties": [
    "Uma contribuição elegível adicional altera o total pela contribuição definida; evento fora do escopo não altera resultado."
  ],
  "reuse": {
    "path": "scripts/agent/validateFinancasBotNextFacts.mjs",
    "locator": "derive.installments_projected_amount",
    "status": "behavior_reference_requires_instrumented_adaptation"
  },
  "limitations": [
    "Assinatura de autoria; executável instrumentado e seu closure ainda não foram construídos/revisados.",
    "A fórmula opera somente sobre handles e roles resolvidos do registry, com escopo/período comprovados pelo grafo.",
    "Não usar oracle como input, autodeclarar trace ou aceitar campo non_material."
  ]
}
