{
  "schema_version": 1,
  "contract_id": "similar_event_ids_v1",
  "metric": "similar_event_ids",
  "unit": "entity_ids",
  "stage": "authoring",
  "signature": {
    "context": "explicit_versioned_instrumented_claim",
    "operands": "resolve_roles_from_metric_evaluator_registry",
    "output": {
      "kind": "id_set"
    }
  },
  "semantics": [
    "Retornar IDs dos eventos confirmed do mês com merchant_key exatamente igual à consultada. Similar aqui é a igualdade revisada de chave, não aproximação textual ou merge automático."
  ],
  "algebraic_properties": [
    "Adicionar membro elegível novo altera exatamente a lista por esse ID; membro fora do escopo não entra."
  ],
  "reuse": {
    "path": "scripts/agent/validateFinancasBotNextFacts.mjs",
    "locator": "derive.similar_event_ids",
    "status": "behavior_reference_requires_instrumented_adaptation"
  },
  "limitations": [
    "Assinatura de autoria; executável instrumentado e seu closure ainda não foram construídos/revisados.",
    "A fórmula opera somente sobre handles e roles resolvidos do registry, com escopo/período comprovados pelo grafo.",
    "Não usar oracle como input, autodeclarar trace ou aceitar campo non_material."
  ]
}
